access with root
acidiag dbgtoken
ssh root@0

```
root@CITCHQAPIC01:~# tcpdump -i oobmgmt host 10.11.255.254
tcpdump: verbose output suppressed, use -v or -vv for full protocol decode
listening on oobmgmt, link-type EN10MB (Ethernet), capture size 262144 bytes
02:45:49.230211 IP 10.11.255.254 > 10.11.255.1: ICMP echo request, id 52, seq 0, length 80
02:45:49.230291 IP 10.11.255.1 > 10.11.255.254: ICMP echo reply, id 52, seq 0, length 80
02:45:49.230693 IP 10.11.255.254 > 10.11.255.1: ICMP echo request, id 52, seq 1, length 80
02:45:49.230719 IP 10.11.255.1 > 10.11.255.254: ICMP echo reply, id 52, seq 1, length 80
02:45:49.231028 IP 10.11.255.254 > 10.11.255.1: ICMP echo request, id 52, seq 2, length 80
02:45:49.231062 IP 10.11.255.1 > 10.11.255.254: ICMP echo reply, id 52, seq 2, length 80
02:45:49.231338 IP 10.11.255.254 > 10.11.255.1: ICMP echo request, id 52, seq 3, length 80
02:45:49.231377 IP 10.11.255.1 > 10.11.255.254: ICMP echo reply, id 52, seq 3, length 80
02:45:49.231676 IP 10.11.255.254 > 10.11.255.1: ICMP echo request, id 52, seq 4, length 80
02:45:49.231707 IP 10.11.255.1 > 10.11.255.254: ICMP echo reply, id 52, seq 4, length 80
^C
10 packets captured
11 packets received by filter
0 packets dropped by kernel
root@CITCHQAPIC01:~# 
```
